Категория,Название,Цена,Ссылка
Диваны,Диван прямой Нумо Velvet Pink,38 990руб. руб.,https://www.divan.ru/product/divan-numo-velvet-pink
Диваны,Банкетка Вайли Velvet Light,10 990руб. руб.,https://www.divan.ru/product/banketka-vajli-velvet-light
Диваны,Диван прямой Риен Velvet Stone,58 990руб. руб.,https://www.divan.ru/product/divan-rien-velvet-stone
Диваны,Кресло Кото Cozy Beige,32 990руб. руб.,https://www.divan.ru/product/kreslo-koto-cozy-beige
Диваны,Диван прямой Нумо Мини Textile Yellow,26 990руб. руб.,https://www.divan.ru/product/divan-numo-mini-textile-yellow
Диваны,Диван угловой Онте Bucle Silver,109 990руб. руб.,https://www.divan.ru/product/divan-uglovoj-onte-bucle-silver
Диваны,Кресло Витио Velvet Yellow,22 990руб. руб.,https://www.divan.ru/product/kreslo-vitio-velvet-yellow-new
Диваны,Кресло Пайпел-2 Bucle Forest,40 990руб. руб.,https://www.divan.ru/product/kreslo-pajpel-2-bucle-forest
Диваны,Диван прямой Види Textile Navy Blue,25 990руб. руб.,https://www.divan.ru/product/divan-vidi-textile-navy-blue
Диваны,Кресло Ансил Bucle Milk,31 990руб. руб.,https://www.divan.ru/product/kreslo-ansil-bucle-milk
Диваны,Диван угловой Аронт Мини Velvet Olive,59 990руб. руб.,https://www.divan.ru/product/divan-uglovoj-aront-mini-velvet-olive
Диваны,Пуф Кропс Bucle Lilac,8990руб. руб.,https://www.divan.ru/product/puf-krops-bucle-lilac
Диваны,Пуф Кофи Velvet Light,4590руб. руб.,https://www.divan.ru/product/puf-kofi-velvet-light
Диваны,Кресло Тилар Textile Yellow,23 990руб. руб.,https://www.divan.ru/product/kreslo-tilar-textile-yellow
Диваны,Диван прямой Лави Velvet Moss,44 990руб. руб.,https://www.divan.ru/product/divan-lavi-velvet-moss
Диваны,Диван прямой Викс Textile Silver,24 990руб. руб.,https://www.divan.ru/product/divan-viks-textile-silver
Диваны,Кресло Лонди Cozy Ivory,43 990руб. руб.,https://www.divan.ru/product/kreslo-londi-cozy-ivory
Диваны,Диван прямой Лилле Velvet Atlantic,46 990руб. руб.,https://www.divan.ru/product/divan-lille-velvet-atlantic
Диваны,Пуф Дзен-1 Velvet Beige,9990руб. руб.,https://www.divan.ru/product/puf-dzen-1-velvet-beige
Диваны,Диван прямой Саннес Velvet Terra,44 990руб. руб.,https://www.divan.ru/product/divan-sannes-velvet-terra
Диваны,Диван прямой Роттердам Velvet Silver,27 990руб. руб.,https://www.divan.ru/product/divan-rotterdam-velvet-silver
Диваны,Диван прямой Сваут Velvet Beige,66 990руб. руб.,https://www.divan.ru/product/divan-svaut-velvet-beige
Диваны,Диван угловой Стаус Velvet Olive,42 990руб. руб.,https://www.divan.ru/product/divan-uglovoj-staus-velvet-olive
Диваны,Кресло Кальдера Barhat Mint,34 990руб. руб.,https://www.divan.ru/product/kreslo-kaldera-barhat-mint
Диваны,Диван прямой Терм Velvet Beige,69 990руб. руб.,https://www.divan.ru/product/divan-term-velvet-beige
Диваны,Кресло-кровать Кейсес Velvet Grey,22 990руб. руб.,https://www.divan.ru/product/kreslo-krovat-kejses-velvet-grey
Диваны,Кушетка Ринт Bucle Pink,21 990руб. руб.,https://www.divan.ru/product/kushetka-rint-bucle-pink
Диваны,Диван прямой Тайлин Velvet Yellow,39 990руб. руб.,https://www.divan.ru/product/divan-tajlin-velvet-yellow
Диваны,Кресло Элвит Cozy Ivory,29 990руб. руб.,https://www.divan.ru/product/kreslo-elvit-cozy-ivory
Диваны,Диван прямой Слипсон Velvet Silver,59 990руб. руб.,https://www.divan.ru/product/divan-slipson-velvet-silver
Диваны,Диван угловой Аллаум Linia Mint,54 990руб. руб.,https://www.divan.ru/product/divan-uglovoj-allaum-linia-mint
Диваны,Кресло Винси Textile Ginger,20 990руб. руб.,https://www.divan.ru/product/kreslo-vinsi-textile-ginger
Диваны,Диван прямой Рон Textile Grafit,54 990руб. руб.,https://www.divan.ru/product/divan-ron-textile-grafit
Диваны,Диван модульный Этен 1 Vertical Milk,115 950руб. руб.,https://www.divan.ru/product/modulnyj-divan-eten-1-vertical-milk
Диваны,Диван прямой Спейс Soft Navy Blue,66 990руб. руб.,https://www.divan.ru/product/divan-spejs-soft-navy-blue
Диваны,Пуф Акера-2 Velvet Yellow,11 990руб. руб.,https://www.divan.ru/product/puf-akera-2-velvet-yellow
Диваны,Диван прямой Эби Мини Linia Mint,58 990руб. руб.,https://www.divan.ru/product/divan-abi-mini-linia-mint
Диваны,Диван прямой Льери Barhat Blue,84 990руб. руб.,https://www.divan.ru/product/divan-leri-barhat-blue
Диваны,Диван угловой Маркфул Velvet Light,79 990руб. руб.,https://www.divan.ru/product/divan-uglovoj-markful-velvet-light
Диваны,Диван прямой Сваут Velvet Moss,66 990руб. руб.,https://www.divan.ru/product/divan-svaut-velvet-moss
Диваны,Диван прямой Льери Мини Velvet Light,59 990руб. руб.,https://www.divan.ru/product/divan-leri-mini-velvet-light
Диваны,Диван прямой Эби Velvet Blue,66 990руб. руб.,https://www.divan.ru/product/divan-ebi-velvet-blue
Диваны,Диван прямой Спейс-2 Velvet Beige,89 990руб. руб.,https://www.divan.ru/product/divan-spejs-2-velvet-beige
Диваны,Диван модульный Риббл-1 Bucle Lilac,78 980руб. руб.,https://www.divan.ru/product/modulnyj-divan-ribbl-1-bucle-lilac
Диваны,Кресло Кальдера Bucle Cloud,36 990руб. руб.,https://www.divan.ru/product/kreslo-kaldera-bucle-cloud
Диваны,Кресло Тилар Cozy Milk,23 990руб. руб.,https://www.divan.ru/product/kreslo-tilar-cozy-milk
Диваны,Диван угловой Дарол Velvet Silver,67 990руб. руб.,https://www.divan.ru/product/divan-uglovoj-darol-velvet-silver
Диваны,Диван прямой Дисент Velvet Beige,79 990руб. руб.,https://www.divan.ru/product/divan-disent-velvet-beige
Кресла,Кресло Витио Velvet Silver,22 990руб. руб.,https://www.divan.ru/product/kreslo-vitio-velvet-silver
Кресла,Кресло Витио Velvet Yellow,22 990руб. руб.,https://www.divan.ru/product/kreslo-vitio-velvet-yellow-new
Кресла,Кресло Витио Velvet Mint,22 990руб. руб.,https://www.divan.ru/product/kreslo-vitio-velvet-mint
Кресла,Кресло Витио Velvet Milk,22 990руб. руб.,https://www.divan.ru/product/kreslo-vitio-velvet-milk
Кресла,Кресло Витио Velvet Violet,22 990руб. руб.,https://www.divan.ru/product/kreslo-vitio-velvet-violet
Кресла,Кресло Витио Bucle White,29 990руб. руб.,https://www.divan.ru/product/kreslo-vitio-bucle-white
Кресла,Кресло Витио Velvet Coral,22 990руб. руб.,https://www.divan.ru/product/kreslo-vitio-velvet-coral
Кресла,Кресло Тилар Textile Navy Blue,23 990руб. руб.,https://www.divan.ru/product/kreslo-tilar-textile-navy-blue
Кресла,Кресло Тилар Textile Grey,23 990руб. руб.,https://www.divan.ru/product/kreslo-tilar-textile-grey
Кресла,Кресло Тилар Cozy Milk,23 990руб. руб.,https://www.divan.ru/product/kreslo-tilar-cozy-milk
Кресла,Кресло Тилар Textile Beige,23 990руб. руб.,https://www.divan.ru/product/kreslo-tilar-textile-beige
Кресла,Кресло Тилар Textile Grafit,23 990руб. руб.,https://www.divan.ru/product/kreslo-tilar-textile-grafit
Кресла,Кресло Тилар Textile Yellow,23 990руб. руб.,https://www.divan.ru/product/kreslo-tilar-textile-yellow
Кресла,Кресло Тилар Textile Plum,23 990руб. руб.,https://www.divan.ru/product/kreslo-tilar-textile-plum
Кресла,Кресло Пайл Barhat Beige,24 990руб. руб.,https://www.divan.ru/product/kreslo-pajl-barhat-beige
Кресла,Кресло Пайл Textile Ginger,26 990руб. руб.,https://www.divan.ru/product/kreslo-pajl-textile-ginger
Кресла,Кресло Пайл Bucle Smoky,26 990руб. руб.,https://www.divan.ru/product/kreslo-pajl-bucle-smoky
Кресла,Кресло Пайл Cozy Milk,24 990руб. руб.,https://www.divan.ru/product/kreslo-pajl-cozy-milk
Кресла,Кресло Пайл Barhat Night,24 990руб. руб.,https://www.divan.ru/product/kreslo-pajl-barhat-night
Кресла,Кресло Пайл Barhat Smoke,24 990руб. руб.,https://www.divan.ru/product/kreslo-pajl-barhat-smoke
Кресла,Кресло Пайл Barhat Forest,24 990руб. руб.,https://www.divan.ru/product/kreslo-pajl-barhat-forest
Кресла,Кресло-кровать Види Textile Yellow,21 990руб. руб.,https://www.divan.ru/product/kreslo-krovat-vidi-textile-yellow
Кресла,Кресло-кровать Види Textile Navy Blue,21 990руб. руб.,https://www.divan.ru/product/kreslo-krovat-vidi-textile-navy-blue
Кресла,Кресло-кровать Види Textile Light,21 990руб. руб.,https://www.divan.ru/product/kreslo-krovat-vidi-textile-light
Кресла,Кресло-кровать Види Textile Ocean,21 990руб. руб.,https://www.divan.ru/product/kreslo-krovat-vidi-textile-ocean
Кресла,Кресло-кровать Види Textile Coral,21 990руб. руб.,https://www.divan.ru/product/kreslo-krovat-vidi-textile-coral
Кресла,Кресло-кровать Види Textile Grey,21 990руб. руб.,https://www.divan.ru/product/kreslo-krovat-vidi-textile-grey
Кресла,Кресло-кровать Види Textile Grafit,21 990руб. руб.,https://www.divan.ru/product/kreslo-krovat-vidi-textile-grafit
Кресла,Кресло Ансил Bucle Marble,27 990руб. руб.,https://www.divan.ru/product/kreslo-ansil-bucle-marble
Кресла,Кресло Ансил Barhat Beige,23 990руб. руб.,https://www.divan.ru/product/kreslo-ansil-barhat-beige
Кресла,Кресло Ансил Bucle Milk,31 990руб. руб.,https://www.divan.ru/product/kreslo-ansil-bucle-milk
Кресла,Кресло Ансил Barhat Blue,23 990руб. руб.,https://www.divan.ru/product/kreslo-ansil-barhat-blue
Кресла,Кресло Ансил Barhat Terra,23 990руб. руб.,https://www.divan.ru/product/kreslo-ansil-barhat-terra
Кресла,Кресло Ансил Barhat Smoke,23 990руб. руб.,https://www.divan.ru/product/kreslo-ansil-barhat-smoke
Кресла,Кресло Ансил Happy Mint,23 990руб. руб.,https://www.divan.ru/product/kreslo-ansil-happy-mint
Кресла,Кресло Кенсол Velvet Grafit,19 990руб. руб.,https://www.divan.ru/product/kreslo-kensol-velvet-grafit
Кресла,Кресло Кенсол Velvet Latte,19 990руб. руб.,https://www.divan.ru/product/kreslo-kensol-velvet-latte
Кресла,Кресло Кенсол Velvet Smoke,19 990руб. руб.,https://www.divan.ru/product/kreslo-kensol-velvet-grey
Кресла,Кресло Кенсол Velvet Blue,17 990руб. руб.,https://www.divan.ru/product/kreslo-kensol-velvet-blue
Кресла,Кресло Тут Рядом Мечта Оранжевое,14 990руб. руб.,https://www.divan.ru/product/kreslo-tut-ryadom-mechta-oranjevoe
Кресла,Кресло Тут Рядом Мечта Синее,14 990руб. руб.,https://www.divan.ru/product/kreslo-tut-ryadom-mechta-sinee
Кресла,Кресло Тут Рядом Мечта Желтое,14 990руб. руб.,https://www.divan.ru/product/kreslo-tut-ryadom-mechta-jeltoe
Кресла,Кресло Тут Рядом Мечта Серо-графитовое,19 990руб. руб.,https://www.divan.ru/product/kreslo-tut-ryadom-mechta-sero-grafitovoe
Кресла,Кресло Тут Рядом Мечта Бежевое,14 990руб. руб.,https://www.divan.ru/product/kreslo-tut-ryadom-mechta-bejevoe
Кресла,Кресло Тут Рядом Мечта Сине-бежевое,19 990руб. руб.,https://www.divan.ru/product/kreslo-tut-ryadom-mechta-sine-bejevoe
Кресла,Кресло Тут Рядом Мечта Серое,14 990руб. руб.,https://www.divan.ru/product/kreslo-tut-ryadom-mechta-seroe
Кресла,Кресло Дженкс Textile Coral,20 990руб. руб.,https://www.divan.ru/product/kreslo-djenks-textile-coral
Кресла,Кресло Дженкс Textile Grafit,20 990руб. руб.,https://www.divan.ru/product/kreslo-djenks-textile-grafit
Кресла,Кресло Дженкс Textile Light,20 990руб. руб.,https://www.divan.ru/product/kreslo-djenks-textile-light
Кресла,Кресло Дженкс Textile Blue,20 990руб. руб.,https://www.divan.ru/product/kreslo-djenks-textile-blue
Кресла,Кресло Дженкс Textile Silver,20 990руб. руб.,https://www.divan.ru/product/kreslo-djenks-textile-silver
Кресла,Кресло Дженкс Textile Yellow,20 990руб. руб.,https://www.divan.ru/product/kreslo-djenks-textile-yellow
Кресла,Кресло Дженкс Happy Emerald,20 990руб. руб.,https://www.divan.ru/product/kreslo-djenks-happy-emerald
Кресла,Кресло Кальдера Barhat Orange,34 990руб. руб.,https://www.divan.ru/product/kreslo-kaldera-barhat-orange
Кресла,Кресло Кальдера Bucle Storm,36 990руб. руб.,https://www.divan.ru/product/kreslo-kaldera-bucle-storm
Кресла,Кресло Кальдера Bucle Cloud,36 990руб. руб.,https://www.divan.ru/product/kreslo-kaldera-bucle-cloud
Кресла,Кресло Кальдера Barhat Light,34 990руб. руб.,https://www.divan.ru/product/kreslo-kaldera-barhat-light
Кресла,Кресло Кальдера Bucle Marble,36 990руб. руб.,https://www.divan.ru/product/kreslo-kaldera-bucle-marble
Кресла,Кресло Кальдера Barhat Navy Blue,34 990руб. руб.,https://www.divan.ru/product/kreslo-kaldera-barhat-navy-blue
Кресла,Кресло Кальдера Barhat Mint,34 990руб. руб.,https://www.divan.ru/product/kreslo-kaldera-barhat-mint
Кресла,Кресло-кровать Кейсес Velvet Grey,22 990руб. руб.,https://www.divan.ru/product/kreslo-krovat-kejses-velvet-grey
Кресла,Кресло-кровать Кейсес Velvet Pink,22 990руб. руб.,https://www.divan.ru/product/kreslo-krovat-kejses-velvet-pink
Кресла,Кресло-кровать Кейсес Velvet Latte,22 990руб. руб.,https://www.divan.ru/product/kreslo-krovat-kejses-velvet-latte
Кресла,Кресло-кровать Кейсес Velvet Yellow,22 990руб. руб.,https://www.divan.ru/product/kreslo-krovat-kejses-velvet-yellow
Кресла,Кресло-кровать Кейсес Velvet Grafit,22 990руб. руб.,https://www.divan.ru/product/kreslo-krovat-kejses-velvet-grafit
Кресла,Кресло-кровать Кейсес Velvet Navy Blue,22 990руб. руб.,https://www.divan.ru/product/kreslo-krovat-kejses-velvet-navy-blue
Кресла,Кресло-кровать Кейсес Velvet Olive,22 990руб. руб.,https://www.divan.ru/product/kreslo-krovat-kejses-velvet-olive
Светильники,Подвесной светильник Ферум Orange,4990руб. руб.,https://www.divan.ru/product/podvesnoj-svetilnik-ferum-orange
Светильники,Светильник потолочный Ринга Black,3990руб. руб.,https://www.divan.ru/product/svetilnik-potolochnyj-ringa-black
Светильники,Торшер Бьйорк White,8990руб. руб.,https://www.divan.ru/product/torsher-bjork-white
Светильники,Подвесной светильник Тубули-5 Wood,12 490руб. руб.,https://www.divan.ru/product/podvesnoj-svetilnik-tubuli-5-wood
Светильники,Бра Смастен White,3690руб. руб.,https://www.divan.ru/product/bra-smasten-white
Светильники,Настольная лампа Арвика Wood,5690руб. руб.,https://www.divan.ru/product/nastolnaya-lampa-arvika-wood
Светильники,Подвесной светильник Инлада Wood,9490руб. руб.,https://www.divan.ru/product/podvesnoj-svetilnik-inlada-wood
Светильники,Настольная лампа Алней Orange,3990руб. руб.,https://www.divan.ru/product/nastolnaya-lampa-alnej-orange
Светильники,Подвесной светильник Намсен Black,10 490руб. руб.,https://www.divan.ru/product/podvesnoj-svetilnik-namsen-black
Светильники,Люстра Ливсден Brown,18 990руб. руб.,https://www.divan.ru/product/lyustra-livsden-brown
Светильники,Торшер Логмар Silver,17 990руб. руб.,https://www.divan.ru/product/torsher-logmar-silver
Светильники,Подвесной светильник Гронтри-1 Wood,13 290руб. руб.,https://www.divan.ru/product/podvesnoj-svetilnik-grontri-1-wood
Светильники,Бра Бракетт White,4290руб. руб.,https://www.divan.ru/product/bra-brakett-white
Светильники,Подвесной светильник Отра Wood,16 490руб. руб.,https://www.divan.ru/product/podvesnoj-svetilnik-otra-wood
Светильники,Подвесной светильник Кронор Orange,7690руб. руб.,https://www.divan.ru/product/podvesnoj-svetilnik-kronor-orange
Светильники,Светильник потолочный Орхус White,15 990руб. руб.,https://www.divan.ru/product/svetilnik-potolochnyj-orhus-white
Светильники,Подвесной светильник Рена Green,3690руб. руб.,https://www.divan.ru/product/podvesnoj-svetilnik-rena-green
Светильники,Светильник потолочный Ринга White,3990руб. руб.,https://www.divan.ru/product/svetilnik-potolochnyj-ringa-white
Светильники,Бра Берит Black,4990руб. руб.,https://www.divan.ru/product/bra-berit-black
Светильники,Подвесной светильник Кронор Black,7490руб. руб.,https://www.divan.ru/product/podvesnoj-svetilnik-kronor-black
Светильники,Настольная лампа Бьйорк White,3290руб. руб.,https://www.divan.ru/product/nastolnaya-lampa-bjork-white
Светильники,Подвесной светильник Селау-2 Glass,3690руб. руб.,https://www.divan.ru/product/podvesnoj-svetilnik-selau-2-glass
Светильники,Подвесной светильник Джамби Rattan,13 690руб. руб.,https://www.divan.ru/product/podvesnoj-svetilnik-djambi-rattan
Светильники,Бра Пинна Black,5990руб. руб.,https://www.divan.ru/product/bra-pinna-black
Светильники,Подвесной светильник Бьйорк White,7990руб. руб.,https://www.divan.ru/product/podvesnoj-svetilnik-bjork-white
Светильники,Торшер Осло Blue,17 990руб. руб.,https://www.divan.ru/product/torsher-oslo-blue
Светильники,Торшер Логмар Black,17 990руб. руб.,https://www.divan.ru/product/torsher-logmar-black
Светильники,Бра Бьйорк White,2490руб. руб.,https://www.divan.ru/product/bra-bjork-white
Светильники,Подвесной светильник Арвика Wood,7690руб. руб.,https://www.divan.ru/product/podvesnoj-svetilnik-arvika-wood
Светильники,Подвесной светильник Бенфлит Black,6490руб. руб.,https://www.divan.ru/product/podvesnoj-svetilnik-benflit-black
Светильники,Светильник потолочный Орхус Black,15 990руб. руб.,https://www.divan.ru/product/svetilnik-potolochnyj-orhus-black
Светильники,Настольная лампа Требен Orange,2990руб. руб.,https://www.divan.ru/product/nastolnaya-lampa-treben-orange
Светильники,Настольная лампа Сканди White,4690руб. руб.,https://www.divan.ru/product/nastolnaya-lampa-skandi-white
Светильники,Подвесной светильник Ливсден Brown,4690руб. руб.,https://www.divan.ru/product/podvesnoj-svetilnik-livsden-brown
Светильники,Подвесной светильник Бейла Black,5990руб. руб.,https://www.divan.ru/product/podvesnoj-svetilnik-bejla-black
Светильники,Светильник потолочный Лаго White,10 290руб. руб.,https://www.divan.ru/product/svetilnik-potolochnyj-lago-white
Светильники,Подвесной светильник Чинкве Silver,5290руб. руб.,https://www.divan.ru/product/podvesnoj-svetilnik-chinkve-silver
Светильники,Торшер Энкель Black,5290руб. руб.,https://www.divan.ru/product/torsher-enkel-black
Светильники,Люстра Малинг Multi,16 990руб. руб.,https://www.divan.ru/product/lyustra-maling-multi
Светильники,Подвесной светильник Джамби-1 Rattan,9690руб. руб.,https://www.divan.ru/product/podvesnoj-svetilnik-djambi-1-rattan
Светильники,Подвесной светильник Селау-1 Glass,3990руб. руб.,https://www.divan.ru/product/podvesnoj-svetilnik-selau-1-glass
Светильники,Подвесной светильник Ферум Black,2990руб. руб.,https://www.divan.ru/product/podvesnoj-svetilnik-ferum-black
Светильники,Бра Смастен Black,3690руб. руб.,https://www.divan.ru/product/bra-smasten-black
Светильники,Подвесной светильник Кронор White,7490руб. руб.,https://www.divan.ru/product/podvesnoj-svetilnik-kronor-white
Светильники,Подвесной светильник Тубули Wood,2690руб. руб.,https://www.divan.ru/product/podvesnoj-svetilnik-tubuli-wood
Светильники,Настольная лампа Требен White,2990руб. руб.,https://www.divan.ru/product/nastolnaya-lampa-treben-white
Светильники,Подвесной светильник Ферум Grey,2490руб. руб.,https://www.divan.ru/product/podvesnoj-svetilnik-ferum-grey
Светильники,Подвесной светильник Квина Black,6490руб. руб.,https://www.divan.ru/product/podvesnoj-svetilnik-kvina-black
